{"$schema":"./mvField3DP3.schema.json","uid":"8ea9a141500fa658a0d61da5bb00ee3ebc96748e","tag":"PoyntingVector","origin":[[-0.225,-0.125,-0.175],[-0.225,-0.125,-0.125],[-0.225,-0.125,-0.07499999999999998],[-0.225,-0.125,-0.024999999999999994],[-0.225,-0.125,0.025000000000000022],[-0.225,-0.125,0.07500000000000001],[-0.225,-0.125,0.125],[-0.225,-0.125,0.17500000000000004],[-0.225,-0.07499999999999998,-0.225],[-0.225,-0.07499999999999998,-0.175],[-0.225,-0.07499999999999998,-0.125],[-0.225,-0.07499999999999998,-0.07499999999999998],[-0.225,-0.07499999999999998,-0.024999999999999994],[-0.225,-0.07499999999999998,0.025000000000000022],[-0.225,-0.07499999999999998,0.07500000000000001],[-0.225,-0.07499999999999998,0.125],[-0.225,-0.07499999999999998,0.17500000000000004],[-0.225,-0.07499999999999998,0.22500000000000003],[-0.225,-0.024999999999999994,-0.225],[-0.225,-0.024999999999999994,-0.175],[-0.225,-0.024999999999999994,-0.125],[-0.225,-0.024999999999999994,-0.07499999999999998],[-0.225,-0.024999999999999994,-0.024999999999999994],[-0.225,-0.024999999999999994,0.025000000000000022],[-0.225,-0.024999999999999994,0.07500000000000001],[-0.225,-0.024999999999999994,0.125],[-0.225,-0.024999999999999994,0.17500000000000004],[-0.225,-0.024999999999999994,0.22500000000000003],[-0.225,0.025000000000000022,-0.225],[-0.225,0.025000000000000022,-0.175],[-0.225,0.025000000000000022,-0.125],[-0.225,0.025000000000000022,-0.07499999999999998],[-0.225,0.025000000000000022,-0.024999999999999994],[-0.225,0.025000000000000022,0.025000000000000022],[-0.225,0.025000000000000022,0.07500000000000001],[-0.225,0.025000000000000022,0.125],[-0.225,0.025000000000000022,0.17500000000000004],[-0.225,0.025000000000000022,0.22500000000000003],[-0.225,0.07500000000000001,-0.225],[-0.225,0.07500000000000001,-0.175],[-0.225,0.07500000000000001,-0.125],[-0.225,0.07500000000000001,-0.07499999999999998],[-0.225,0.07500000000000001,-0.024999999999999994],[-0.225,0.07500000000000001,0.025000000000000022],[-0.225,0.07500000000000001,0.07500000000000001],[-0.225,0.07500000000000001,0.125],[-0.225,0.07500000000000001,0.17500000000000004],[-0.225,0.07500000000000001,0.22500000000000003],[-0.225,0.12500000000000003,-0.225],[-0.225,0.12500000000000003,-0.175],[-0.225,0.12500000000000003,-0.125],[-0.225,0.12500000000000003,-0.07499999999999998],[-0.225,0.12500000000000003,-0.024999999999999994],[-0.225,0.12500000000000003,0.025000000000000022],[-0.225,0.12500000000000003,0.07500000000000001],[-0.225,0.12500000000000003,0.125],[-0.225,0.12500000000000003,0.17500000000000004],[-0.225,0.12500000000000003,0.22500000000000003],[-0.225,0.17500000000000002,-0.225],[-0.225,0.17500000000000002,-0.175],[-0.225,0.17500000000000002,-0.125],[-0.225,0.17500000000000002,-0.07499999999999998],[-0.225,0.17500000000000002,-0.024999999999999994],[-0.225,0.17500000000000002,0.025000000000000022],[-0.225,0.17500000000000002,0.07500000000000001],[-0.225,0.17500000000000002,0.125],[-0.225,0.17500000000000002,0.17500000000000004],[-0.225,0.17500000000000002,0.22500000000000003],[-0.225,0.225,-0.225],[-0.225,0.225,-0.175],[-0.225,0.225,-0.125],[-0.225,0.225,-0.07499999999999998],[-0.225,0.225,-0.024999999999999994],[-0.225,0.225,0.025000000000000022],[-0.225,0.225,0.07500000000000001],[-0.225,0.225,0.125],[-0.225,0.225,0.17500000000000004],[-0.225,0.225,0.22500000000000003],[-0.225,0.275,-0.225],[-0.225,0.275,-0.175],[-0.225,0.275,-0.125],[-0.225,0.275,-0.07499999999999998],[-0.225,0.275,-0.024999999999999994],[-0.225,0.275,0.025000000000000022],[-0.225,0.275,0.07500000000000001],[-0.225,0.275,0.125],[-0.225,0.275,0.17500000000000004],[-0.225,0.275,0.22500000000000003],[-0.225,0.32500000000000007,-0.175],[-0.225,0.32500000000000007,-0.125],[-0.225,0.32500000000000007,-0.07499999999999998],[-0.225,0.32500000000000007,-0.024999999999999994],[-0.225,0.32500000000000007,0.025000000000000022],[-0.225,0.32500000000000007,0.07500000000000001],[-0.225,0.32500000000000007,0.125],[-0.225,0.32500000000000007,0.17500000000000004],[-0.175,-0.125,-0.225],[-0.175,-0.125,-0.175],[-0.175,-0.125,-0.125],[-0.175,-0.125,-0.07499999999999998],[-0.175,-0.125,-0.024999999999999994],[-0.175,-0.125,0.025000000000000022],[-0.175,-0.125,0.07500000000000001],[-0.175,-0.125,0.125],[-0.175,-0.125,0.17500000000000004],[-0.175,-0.125,0.22500000000000003],[-0.175,-0.07499999999999998,-0.225],[-0.175,-0.07499999999999998,-0.175],[-0.175,-0.07499999999999998,-0.125],[-0.175,-0.07499999999999998,-0.07499999999999998],[-0.175,-0.07499999999999998,-0.024999999999999994],[-0.175,-0.07499999999999998,0.025000000000000022],[-0.175,-0.07499999999999998,0.07500000000000001],[-0.175,-0.07499999999999998,0.125],[-0.175,-0.07499999999999998,0.17500000000000004],[-0.175,-0.07499999999999998,0.22500000000000003],[-0.175,-0.024999999999999994,-0.225],[-0.175,-0.024999999999999994,-0.175],[-0.175,-0.024999999999999994,-0.125],[-0.175,-0.024999999999999994,-0.07499999999999998],[-0.175,-0.024999999999999994,-0.024999999999999994],[-0.175,-0.024999999999999994,0.025000000000000022],[-0.175,-0.024999999999999994,0.07500000000000001],[-0.175,-0.024999999999999994,0.125],[-0.175,-0.024999999999999994,0.17500000000000004],[-0.175,-0.024999999999999994,0.22500000000000003],[-0.175,0.025000000000000022,-0.225],[-0.175,0.025000000000000022,-0.175],[-0.175,0.025000000000000022,-0.125],[-0.175,0.025000000000000022,-0.07499999999999998],[-0.175,0.025000000000000022,-0.024999999999999994],[-0.175,0.025000000000000022,0.025000000000000022],[-0.175,0.025000000000000022,0.07500000000000001],[-0.175,0.025000000000000022,0.125],[-0.175,0.025000000000000022,0.17500000000000004],[-0.175,0.025000000000000022,0.22500000000000003],[-0.175,0.07500000000000001,-0.225],[-0.175,0.07500000000000001,-0.175],[-0.175,0.07500000000000001,-0.125],[-0.175,0.07500000000000001,-0.07499999999999998],[-0.175,0.07500000000000001,-0.024999999999999994],[-0.175,0.07500000000000001,0.025000000000000022],[-0.175,0.07500000000000001,0.07500000000000001],[-0.175,0.07500000000000001,0.125],[-0.175,0.07500000000000001,0.17500000000000004],[-0.175,0.07500000000000001,0.22500000000000003],[-0.175,0.12500000000000003,-0.225],[-0.175,0.12500000000000003,-0.175],[-0.175,0.12500000000000003,-0.125],[-0.175,0.12500000000000003,-0.07499999999999998],[-0.175,0.12500000000000003,-0.024999999999999994],[-0.175,0.12500000000000003,0.025000000000000022],[-0.175,0.12500000000000003,0.07500000000000001],[-0.175,0.12500000000000003,0.125],[-0.175,0.12500000000000003,0.17500000000000004],[-0.175,0.12500000000000003,0.22500000000000003],[-0.175,0.17500000000000002,-0.225],[-0.175,0.17500000000000002,-0.175],[-0.175,0.17500000000000002,-0.125],[-0.175,0.17500000000000002,-0.07499999999999998],[-0.175,0.17500000000000002,-0.024999999999999994],[-0.175,0.17500000000000002,0.025000000000000022],[-0.175,0.17500000000000002,0.07500000000000001],[-0.175,0.17500000000000002,0.125],[-0.175,0.17500000000000002,0.17500000000000004],[-0.175,0.17500000000000002,0.22500000000000003],[-0.175,0.225,-0.225],[-0.175,0.225,-0.175],[-0.175,0.225,-0.125],[-0.175,0.225,-0.07499999999999998],[-0.175,0.225,-0.024999999999999994],[-0.175,0.225,0.025000000000000022],[-0.175,0.225,0.07500000000000001],[-0.175,0.225,0.125],[-0.175,0.225,0.17500000000000004],[-0.175,0.225,0.22500000000000003],[-0.175,0.275,-0.225],[-0.175,0.275,-0.175],[-0.175,0.275,-0.125],[-0.175,0.275,-0.07499999999999998],[-0.175,0.275,-0.024999999999999994],[-0.175,0.275,0.025000000000000022],[-0.175,0.275,0.07500000000000001],[-0.175,0.275,0.125],[-0.175,0.275,0.17500000000000004],[-0.175,0.275,0.22500000000000003],[-0.175,0.32500000000000007,-0.225],[-0.175,0.32500000000000007,-0.175],[-0.175,0.32500000000000007,-0.125],[-0.175,0.32500000000000007,-0.07499999999999998],[-0.175,0.32500000000000007,-0.024999999999999994],[-0.175,0.32500000000000007,0.025000000000000022],[-0.175,0.32500000000000007,0.07500000000000001],[-0.175,0.32500000000000007,0.125],[-0.175,0.32500000000000007,0.17500000000000004],[-0.175,0.32500000000000007,0.22500000000000003],[-0.125,-0.125,-0.225],[-0.125,-0.125,-0.175],[-0.125,-0.125,-0.125],[-0.125,-0.125,-0.07499999999999998],[-0.125,-0.125,-0.024999999999999994],[-0.125,-0.125,0.025000000000000022],[-0.125,-0.125,0.07500000000000001],[-0.125,-0.125,0.125],[-0.125,-0.125,0.17500000000000004],[-0.125,-0.125,0.22500000000000003],[-0.125,-0.07499999999999998,-0.225],[-0.125,-0.07499999999999998,-0.175],[-0.125,-0.07499999999999998,-0.125],[-0.125,-0.07499999999999998,-0.07499999999999998],[-0.125,-0.07499999999999998,-0.024999999999999994],[-0.125,-0.07499999999999998,0.025000000000000022],[-0.125,-0.07499999999999998,0.07500000000000001],[-0.125,-0.07499999999999998,0.125],[-0.125,-0.07499999999999998,0.17500000000000004],[-0.125,-0.07499999999999998,0.22500000000000003],[-0.125,-0.024999999999999994,-0.225],[-0.125,-0.024999999999999994,-0.175],[-0.125,-0.024999999999999994,-0.125],[-0.125,-0.024999999999999994,-0.07499999999999998],[-0.125,-0.024999999999999994,-0.024999999999999994],[-0.125,-0.024999999999999994,0.025000000000000022],[-0.125,-0.024999999999999994,0.07500000000000001],[-0.125,-0.024999999999999994,0.125],[-0.125,-0.024999999999999994,0.17500000000000004],[-0.125,-0.024999999999999994,0.22500000000000003],[-0.125,0.025000000000000022,-0.225],[-0.125,0.025000000000000022,-0.175],[-0.125,0.025000000000000022,-0.125],[-0.125,0.025000000000000022,-0.07499999999999998],[-0.125,0.025000000000000022,-0.024999999999999994],[-0.125,0.025000000000000022,0.025000000000000022],[-0.125,0.025000000000000022,0.07500000000000001],[-0.125,0.025000000000000022,0.125],[-0.125,0.025000000000000022,0.17500000000000004],[-0.125,0.025000000000000022,0.22500000000000003],[-0.125,0.07500000000000001,-0.225],[-0.125,0.07500000000000001,-0.175],[-0.125,0.07500000000000001,-0.125],[-0.125,0.07500000000000001,-0.07499999999999998],[-0.125,0.07500000000000001,-0.024999999999999994],[-0.125,0.07500000000000001,0.025000000000000022],[-0.125,0.